results/CV_ACT_DEPTH_AUG_CHUNK_100.csv

Shared Model,Success %,,,,
top_long,61.67%,,,,
top_short,43.33%,,,Macro-Average,59.79%
pant_long,50%,,,,
pant_short,84.17%,,,,
,,,,,
,,,,,
Unseen Percentages,Unseen_0,Unseen_1,Average,,
top_long,80.00%,10.00%,45.00%,,
top_short,0.00%,70.00%,35.00%,,
pant_long,90.00%,50.00%,70.00%,,
pant_short,20.00%,90.00%,55.00%,,

update_paper_objective.md

Shared Model	Success %					
top_long	55.00%					
top_short	20.00%			Macro-Average	46.67%	
pant_long	30%					
pant_short	81.67%

Unseen Percentages	Unseen_0	Unseen_1	Average			
top_long	80.00%	40.00%	60.00%			
top_short	60.00%	0.00%	30.00%			
pant_long	90.00%	50.00%	70.00%			
pant_short	20.00%	60.00%	40.00%

Unseen Percentages	Unseen_0	Unseen_1	Average		
top_long	90.00%	10.00%	50.00%		
top_short	0.00%	0.00%	0.00%		
pant_long	50.00%	0.00%	25.00%		
pant_short	10.00%	40.00%	25.00%

Unseen Percentages	Unseen_0	Unseen_1	Average		
top_long	100.00%	70.00%	85.00%		
top_short	0.00%	60.00%	30.00%		
pant_long	50.00%	10.00%	30.00%		
pant_short	0.00%	90.00%	45.00%

Unseen Percentages	Unseen_0	Unseen_1	Average		
top_long	100.00%	20.00%	60.00%		
top_short	0.00%	70.00%	35.00%		
pant_long	20.00%	0.00%	10.00%		
pant_short	10.00%	100.00%	55.00%

7) ACT_DEPTH_AUG
Shared Model	Success %				
top_long	61.67%				
top_short	43.33%			Macro-Average	59.79%
pant_long	50%				
pant_short	84.17%

Unseen Percentages	Unseen_0	Unseen_1	Average		
top_long	80.00%	10.00%	45.00%		
top_short	0.00%	70.00%	35.00%		
pant_long	90.00%	50.00%	70.00%		
pant_short	20.00%	90.00%	55.00%